group_id,group_name,description,group_name_2,group_name_3
22,Python 3.4前後の標準ライブラリ拡張,"このグループは、2012〜2014年ごろのPython 3.4周辺で進んだ標準ライブラリと実行環境の拡張を中心にまとまっています。ネットワーク図ではPEP 429がハブになっており、3.4のリリース時期に関連する提案群を束ねている構造が見えます。内容としては、435と354の列挙型、453と477および711の配布・導入、431と615のタイムゾーン、445と454のメモリ管理や計測、433と446のファイル記述子安全性など、言語コア周辺の実用機能が広く含まれます。FinalのPEPが多く、Python本体や標準ライブラリ、実行環境整備に関係するまとまりと見てよさそうですが、やや雑多で実装基盤寄りの提案も混ざっています。
このグループのPEPを読むことで、Python 3.4期に何が標準機能として整備されたかをつかめます。",標準ライブラリ採用と実行環境整備,Python 3.4世代の基盤機能追加
23,演算子拡張と不変マッピング,"このグループの主な技術テーマは、Pythonの式構文を広げる演算子提案と、辞書まわりの不変・最適化データ構造です。ネットワーク図では PEP 505、531、532 が大きな核になっており、None処理や存在確認、短絡評価に関わる演算子設計が強く結び付いて見えます。周辺には 412、509、603、814 など辞書の共有・版管理・不変マップに関する提案が集まり、言語仕様と実行時データ構造の境界にある検討群といえます。2004年から2025年まで年代はかなり幅広く、Rejected・Deferred・Withdrawn が多い一方で Final や Accepted も一部あり、長く議論されてきた実験的領域だと読み取れます。
このグループのPEPを読むことで、Pythonが新しい演算子や不変辞書をどこまで受け入れるかの設計判断をつかめそうです。",式構文の拡張と辞書内部設計,Python演算子提案と不変辞書API
24,関数シグネチャとクラス生成の言語設計,"このグループは、Python 3系での関数呼び出し規則とオブジェクトモデルの整理を中心にした言語仕様の提案群です。中心にはPEP 3102、3115、3135があり、キーワード専用引数、メタクラス、継承まわりの振る舞いなど、関数定義とクラス作成の基盤に関わる話題が集まっています。ネットワーク図でも3102が大きなハブになっており、570や3113、457とつながることで、位置専用・キーワード専用を含む引数設計が一つの核になっていると読めます。2006〜2008年のPython 3移行期のFinalなPEPが多い一方で、422・3130・736のようなWithdrawnやRejectedも含まれ、周辺にクラス生成の簡略化や呼び出し構文の試行錯誤が見えます。
このグループのPEPを読むことで、Python 3の関数定義とクラス機構がどう整えられてきたかをつかめそうです。",Python 3の呼び出し規約とオブジェクトモデル,引数仕様・継承・メタクラスの進化
25,Pythonのリリースサイクルと版管理,このグループの主題は、Python本体のリリース方針、年間サイクル、各バージョンの公開計画です。ネットワーク図でもPEP 602が最も大きく中心にあり、596、598、605、607や各版のスケジュールPEPがそこに集まる構造になっていて、近年の運用方針の中核を示しているように見えます。機能領域としては言語仕様そのものより、CPythonの開発プロセス、リリースエンジニアリング、プロジェクト運営に関係します。2019年以降のPEPが多く、ActiveとFinalが中心ですが、WithdrawnやRejectedも含まれており、現在の年次リリース体制に至るまでの検討過程も読めます。これらのPEPを読むことで、Pythonがどの周期で進化し、機能提供のタイミングがどう設計されているかをつかめそうです。,CPythonリリース運用ポリシー,Pythonバージョン計画と公開スケジュール
26,数値演算子と配列演算,"このグループの主な技術テーマは、Pythonにおける数値計算向けの演算子設計と、多次元配列を扱うための演算モデルです。ネットワーク図でもPEP 211、465、225が大きく密につながっており、初期に提案された演算子拡張の議論が、のちの465のような実装済みの数値計算機能へ収束した流れが見えます。207や208も周辺で関係しており、比較や型変換を含む演算仕様の整理という文脈がうかがえます。年代は2000年前後の初期提案と2014〜2015年の実装・周辺整備に分かれており、441、471、488、820などはやや周辺的なPEPとして混ざっています。
このグループのPEPを読むことで、Pythonで数値演算の文法と意味論がどう形作られたかをつかめるかもしれません。",数値計算の演算子設計,行列・配列演算の言語機能
27,後方互換性と移行ポリシー,"このグループの主な技術テーマは、Python言語の後方互換性をどう保ちながら仕様変更を導入するか、そのための移行手段や運用方針です。ネットワーク図でも PEP 236 が大きなハブになっており、5、264、227、238、230 などの初期の重要提案を結び付けて、__future__ による段階的導入、警告、互換性管理が中心にあることが分かります。機能領域としては個別機能というより、言語進化のガバナンス、リリース運用、非互換変更の導入手順に関係します。作成時期は2000年前後の初期PEPが中心で、2010年代後半の 565、606、608 がその考え方を現代的に補足しており、Rejected も含めて方針検討の色が強いクラスターです。
このグループのPEPを読むことで、Pythonが破壊的変更をどのように安全に進めようとしてきたかをつかめます。",Python言語進化の互換性管理,非互換変更の導入と警告フレームワーク
28,標準ライブラリ候補とシステムI/O基盤,"このグループは、標準ライブラリに追加される機能の選定と、その周辺にあるファイルパス・文字エンコーディング・システムI/Oの基盤整備を主題にした提案群です。ネットワーク図ではPEP 411がハブになっており、408や2と結びつきながら、試験的に機能を取り込む仕組みと標準ライブラリ拡張の運用面を中心に据えているように見えます。実装面では 428、519、383、277 がファイルシステム経路やOS境界の文字処理を支え、Pythonの標準ライブラリ設計、システムインターフェース、パス操作の機能領域に関係します。2000年代初頭から2010年代半ばまで年代はやや広く、Finalだけでなく Superseded・Rejected・Deferred も目立つため、採用済み機能と検討途中の標準化案が混在するクラスターです。
このグループのPEPを読むことで、Pythonが標準ライブラリへ機能を取り込む基準と、OS寄りのI/O APIをどう整えてきたかをつかめそうです。",標準ライブラリ設計とパス・エンコーディングAPI,ライブラリ標準化とファイルシステム周辺機能
29,バイナリ配布と互換タグ,"このグループの主題は、Pythonパッケージのバイナリ配布形式と、その互換性を表すタグ設計です。ネットワーク図でも PEP 425 と 427 が大きな中核ノードになっており、wheel 形式と配布物の互換判定がこのまとまりの中心だと分かります。周辺には 513、571、599、600、656 などLinux向け移植性タグの派生提案が集まり、PyPI上の配布実務を整える 527、715 や将来の形式見直しに関わる 491、777 も接続しています。Pythonの機能領域としては、パッケージ管理・配布インフラ・ビルド済み配布の互換性設計に関係し、2012年の基盤提案を起点に2010年代後半から2020年代前半へ拡張された流れが見えます。
このグループのPEPを読むことで、Pythonパッケージを安全かつ広く配れる仕組みの考え方をつかめるでしょう。",Pythonパッケージ配布フォーマット,wheelとプラットフォームタグ
30,型ヒントとランタイム拡張,"このグループは、静的型付けの表現力を広げる提案と、Pythonランタイムの安全性・低レベル機能を拡張する提案が同居するまとまりです。ネットワーク図では PEP 591、586、578 が大きく中心にあり、前二者は型ヒント、578 と 551 は監査やセキュリティ透明性に関わる核になっています。年代は2006年の 3118 から2026年の 829 まで広く、型システム、セキュリティ、バッファプロトコル、C API周辺のDSLがゆるく結び付いた、やや混成的な機能拡張群と見られます。Final のPEPが中心で、Withdrawn の 551 や Rejected の 437 は周辺ノードとして構想段階の広がりを示しています。
このグループのPEPを読むと、Pythonが型安全性と実行時基盤をどう拡張してきたかの流れをつかめそうです。",Pythonコア機能の型・安全性拡張,静的型付けとランタイム基盤機能
31,CPython C API・ABI基盤,"このグループは、CPythonのC APIとABIの安定化、高速な呼び出し規約、Unicode内部表現の整理を中心にした提案群です。ネットワーク図でも PEP 384 と 3149 が大きな核になっており、拡張モジュールの互換性やバイナリ配布の基盤を形作る話題が中心だと読めます。周辺には 579、580、590、575、576 が密につながっており、関数・メソッドの内部実装や呼び出し性能をめぐる設計検討が一つの下位テーマを成しています。さらに 393、623、624、756 はUnicode関連のCレベル変更として接続しており、2009〜2010年の基盤整備から2018年以降の再設計、2020年代の整理や拡張へと続く、実装者向けの機能領域に属するグループです。
このグループのPEPを読むことで、Python拡張の互換性とCPython内部設計の変遷をつかめそうです。",拡張モジュール互換性と呼び出し規約,CPython内部実装と安定ABI
32,構文糖とデコレータ周辺機能,"このグループは、Pythonの書き方を簡潔にしたり表現力を広げたりする、小〜中規模の言語機能追加を中心とした提案群です。ネットワーク図でも PEP 308、318、3129 が大きな中心ノードになっており、条件式・関数/クラスへのメタプログラミング・関数適用のような文法設計の話題が核になっていると見られます。年代は2003〜2007年の提案が中心で、主要ノードの多くが Final であるため、Python 2系後半の文法拡張の定着過程を反映したまとまりと言えそうです。341、353、357 のように周辺の言語仕様や実装寄りの話題も含まれますが、図の構造では中心テーマにぶら下がる周縁ノードとして見えます。
このグループのPEPを読むことで、Pythonが読みやすさを保ちながら構文や記法をどう拡張してきたかをつかめるはずです。",Python文法拡張の設計史,軽量メタプログラミングと言語機能追加
33,Python配布・インストール環境管理,"このグループの主な技術テーマは、Python本体の配布方法、OSごとの起動方法、インストール後の実行環境管理です。中心にはPEP 394、397、405があり、ネットワーク図でも 394 と 397 がハブになっていて、Unix系とWindows系の起動規約、仮想環境、ユーザー単位の導入方法が強く結び付いています。機能領域としては、パッケージ管理そのものよりも、Pythonのインストール運用、ランチャー、仮想環境、実行環境の整備に関わる提案群と見てよさそうです。2011年前後のFinal/ActiveなPEPが核で、773 や 514 はその流れを引き継いでWindowsでの管理を拡張しており、404 や 373 はリリース方針寄り、3146 はやや異質な周辺要素です。
このグループのPEPを読むことで、Pythonを各OSでどう配布し、どう安全に使い分けるかの全体像をつかめます。",Python実行環境とランチャーの標準化,Pythonインストール・仮想環境運用
34,標準ライブラリのセキュリティ強化,"このグループの主題は、乱数生成、秘密情報の扱い、TLS/HTTPS 検証など、Python標準ライブラリの安全性を高める提案です。中心にはPEP 506、504、466があり、ネットワーク図でも 506 と 504 が大きく、周辺の 476、493、524、543 をつなぐ核になっているように見えます。機能領域としては、暗号・通信セキュリティと標準ライブラリ設計にまたがっており、2014〜2017年のPEPが多いことから、Python 2.7系を含む移行期のセキュリティ改善がまとまった塊と考えられます。Final のPEPが中核に多い一方で、543、748のように統一TLS APIを模索する流れや、522、546のような周辺的な却下提案も含まれます。
このグループのPEPを読むと、Pythonが安全なデフォルトをどう整えてきたかをつかめそうです。",Python通信・乱数APIの安全化,TLS・HTTPS・秘密情報管理のPEP群
35,実行コンテキストと非同期クリーンアップ,"このグループの主な技術テーマは、実行中のコンテキスト情報をどのように安全に伝播し、ジェネレータやコルーチン、非同期処理の終了時にどう整合的に後始末するかです。ネットワーク図では PEP 567 が最も大きく、550、568 が近接して結び付いており、2017〜2018年の実行コンテキスト設計が中心核だと読み取れます。Pythonの機能領域としては、非同期処理、ジェネレータの振る舞い、リソース管理、そして一部はC APIの安全性にまたがる話題です。Final の 567 と 442 が実装寄りの安定した核を作る一方で、Withdrawn・Deferred・Draft・Rejected も多く、設計の難しさが強く出ているグループです。
このグループのPEPを読むことで、Pythonが非同期時代のコンテキスト伝播と安全な終了処理をどう整理してきたかをつかめそうです。",非同期実行文脈の設計,コンテキスト伝播と安全な後始末
36,CPythonの新規プラットフォーム対応,このグループの主な技術テーマは、CPythonをどの環境で公式に動かし、どう配布・構築するかというプラットフォーム対応です。ネットワーク図でもPEP 11が大きな中心ノードになっており、730、738、776、816などの新しい提案がそこへ収束しているため、対応方針の基盤として機能していると見られます。機能領域としては、Python処理系の移植性、ビルド基盤、WebAssembly系環境、モバイル対応、周辺パッケージングにまたがります。作成時期は2002年の11を核に、2023年以降のPEPが多く集まっており、近年の対応先拡大が目立ちます。これらのPEPを読むことで、Pythonが新しい実行環境へ広がる流れをつかめそうです。,Python実行環境の移植とサポート方針,モバイル・WebAssembly向けCPython展開
37,例外処理とトレースバック拡張,"このグループの主な技術テーマは、Pythonの例外処理をより表現豊かにし、原因追跡や複数例外の扱いを改善する仕組みです。ネットワーク図でも PEP 3134 が大きな中心ノードになっており、344 からの継承関係を受けつつ、409、415、654、678 へと発展した流れが見えます。機能領域としては、エラーハンドリング、デバッグ支援、トレースバック表示に関わる提案群で、2005年の基礎提案から2020年代の複数例外や注釈追加まで年代的な広がりがあります。中心には Final のPEPが多く、実際のPythonに取り込まれた例外モデルの進化を反映している一方で、490 はCレベル実装、785 と 830 は今後の運用改善を探る周辺提案と見られます。
このグループのPEPを読むことで、Pythonの例外がどう進化してデバッグしやすくなったかをつかめそうです。",Python例外モデルの進化,エラー伝播と例外情報管理
38,型オブジェクトとクラス機構の再設計,"このグループは、Python 2.2 前後に進んだ型オブジェクト・クラス・属性アクセスの統合的な見直しを中心としています。ネットワーク図でも PEP 252 と253が大きな中核ノードになっており、253、252、254が、組み込み型とクラスの境界を整理する流れの中心にあると読めます。主にオブジェクトモデル、型システム、メタプログラミングに関わる機能領域で、Final の提案が核を作る一方、231、254、213には Rejected や Deferred も含まれ、周辺で属性アクセスの設計案が試行されていた様子もうかがえます。2000〜2001年に集中したやや古い提案群で、237や251はリリース移行や数値型整理の文脈で隣接している可能性があります。
このグループのPEPを読むことで、Pythonの型とクラスの土台がどう整えられたかを学べそうです。",Python 2.2期のオブジェクトモデル整備,組み込み型・クラス統合と属性アクセス
39,インターフェースと適応プロトコル,"このグループの主な技術テーマは、Pythonでオブジェクトの振る舞いを共通のインターフェースで扱う方法と、型ごとの差異を吸収する適応の仕組みです。ネットワーク図ではPEP 245が最も大きく中心にあり、246や3124、443へ強く結びついているため、初期のインターフェース設計案を核に、後年の汎用関数や単一ディスパッチへ発展した流れが見えます。Pythonの機能領域としては、オブジェクトモデル、API設計、拡張可能な多態性に関わる話題で、2000年代初頭のRejected提案が中心ですが、443のように一部はFinalとして実用的な形に整理されています。232は周辺的にメタデータ付与、233は支援機能寄りでやや異質ですが、全体としてはインターフェース抽象化の模索を示すまとまりです。
このグループのPEPを読むことで、Pythonで共通APIとディスパッチをどう設計してきたかをつかめそうです。",Pythonの多態性と汎用関数,オブジェクト適応と単一ディスパッチ
40,Python 2.0移行項目,"このグループは、Python 2.0前後の言語変更やリリース計画をまとめた、小規模な移行テーマの集まりです。中心にはPEP 200があり、ネットワーク図でも 214、223 へ分岐するハブとして見えており、この時期の変更点を束ねる役割を持っていたと考えられます。技術的には言語仕様と文字列・出力まわりの挙動変更に関係しており、いずれも2000年に集中した古いFinalの提案です。まとまりは強いものの件数は少なく、独立した大機能群というより、Python 2.0への移行時に確認すべき差分の一部を表しているように見えます。
このグループのPEPを読むことで、Python 2.0で何が変わったかの要点をつかめるはずです。",Python 2.0の言語変更,初期Pythonの仕様更新とリリース計画
41,UnicodeとテキストI/O,"このグループの主な技術テーマは、Pythonにおける文字エンコーディング処理とテキスト入出力の設計です。中心にはPEP 100、3116があり、どちらもFinalで、2000年代前半から後半にかけてPythonの文字列処理基盤を形作った提案と見られます。ネットワーク図でも400が橋渡し役となって100と3116を結んでおり、古いcodecベースの流儀からより新しいI/Oモデルへの移行という構造が読み取れます。Pythonの文字列処理、ファイルI/O、国際化対応に関係する領域で、Deferredの400は周辺的ながら設計の変遷を示しています。
このグループのPEPを読むことで、Pythonのテキスト処理基盤がどう整理されてきたかをつかめるはずです。",文字エンコーディングと新I/O,Pythonテキスト処理基盤
42,CPythonの課題管理移行,"このグループの主な技術テーマは、CPython開発における課題追跡とバグ管理の運用基盤を、従来方式からGitHub中心へ移していくプロジェクトです。ネットワーク図でもPEP 581と588が大きく近い中心ノードになっており、Finalの提案が移行方針と実施計画の中核を成していると読めます。Python本体の言語機能というより、開発プロセス、コントリビューション体験、プロジェクト運営に関係する機能領域です。2018〜2019年に集中した比較的新しい議論で、595は同じ問題意識を持ちながらもWithdrawnであり、中心テーマに対する補助的な位置づけに見えます。
このグループのPEPを読むことで、CPythonの課題管理がどのように近代化されたかを把握できそうです。",CPython開発基盤とIssueトラッキング,GitHub中心のバグ管理運用
43,PythonデータベースAPI標準,"このグループの主な技術テーマは、Pythonからデータベースへ接続するための共通インターフェースの標準化です。中心にあるのはPEP 248で、ネットワーク図でも249から参照される基点になっており、続く248, 249はDB-APIの初期仕様とその改訂版としてまとまっています。どちらもFinalで、1990年代後半に集中しているため、Pythonのデータベースアクセス層の基礎を定めた初期の標準群と見てよさそうです。Pythonの機能領域としては外部データベース連携やライブラリ間互換性に関係します。
このグループのPEPを読むことで、PythonにおけるDB接続APIの共通設計思想をつかめるでしょう。",DB-API仕様,Pythonデータベース接続インターフェース
44,暗号ハッシュAPI,"このグループの主な技術テーマは、Pythonにおける暗号学的ハッシュ関数の標準API設計です。中心にはPEP 247があり、ネットワーク図でも452から参照される基点になっていて、この小さなクラスターが初期仕様とその後継案という直線的な構造であることが分かります。機能領域としてはセキュリティと標準ライブラリAPI設計にまたがっており、2001年の247と2013年の452という年代差から、長期的な見直しの流れも見えます。どちらもFinalで、実装指針としての性格が強いグループです。
このグループのPEPを読むことで、PythonのハッシュAPIがどう標準化・再設計されてきたかをつかめます。",ハッシュ関数インターフェース,Python暗号API設計
45,辞書ビューと反復処理の移行,"このグループの主な技術テーマは、dict の keys・values・items の扱いと、辞書の反復処理を Python 3 流に整理することです。ネットワーク図でも PEP 3106 が大きな中心ノードになっており、Final である 3106 が基礎方針を示し、Withdrawn の 469 がその移行面を補う構造に見えます。Python の機能領域としては、組み込みデータ型とイテレーション仕様、特に Python 2 から 3 への互換性対応に関係します。作成時期は 2006年と2014年で少し離れていますが、中心テーマは一貫して辞書 API の近代化です。
このグループのPEPを読むことで、辞書の反復仕様が Python 3 でどう整理されたかをつかめます。",Python 3の辞書イテレーション仕様,dict APIの近代化と移行
