group_id,group_name,description,group_name_2,group_name_3
0,Pythonパッケージングとビルド標準,このグループの主な技術テーマは、Pythonパッケージの依存関係記述、ビルド方式、配布メタデータ、インストール再現性を含むパッケージング標準です。ネットワーク図でも PEP 508、517、518、621 が大きな中核を作っており、依存仕様と pyproject.toml を軸に多くの提案が周辺へ接続しています。機能領域としては、Pythonのパッケージ管理、ビルドバックエンド、配布フォーマット、PyPI周辺のエコシステムに強く関係します。2015年以降のPEPが中心で、Finalが多い一方、依存グループ、SBOM、外部依存、再現可能インストールのような新しい論点が2020年代後半まで拡張されています。これらのPEPを読むことで、現代的なPythonパッケージ公開とインストールの標準像をつかめるはずです。,pyproject.tomlと依存関係管理,Python配布メタデータとビルド基盤
1,PyPIとパッケージインデックス仕様,"このグループの主な技術テーマは、PyPIを中心としたパッケージ配布基盤、そのリポジトリAPI、公開メタデータ、ミラーリング、そして配布物の信頼性確保です。ネットワーク図でも PEP 381、503、458、691 が大きなハブになっており、古いミラー運用の議論から、Simple APIの標準化、JSON化、署名やアテステーションまでが密接につながる中心軸だと読み取れます。Pythonの機能領域としては、パッケージ管理と配布インフラに属し、2010年代前半のPyPI運用整理から、2020年代のAPI拡張やサプライチェーン防御へと関心が広がっているのが特徴です。FinalやAcceptedの中核PEPが多く、実運用に強く結びついた仕様群ですが、305のように周辺的に見えるものや、817・825のような将来の配布形式寄りの提案も一部含まれます。
このグループのPEPを読むことで、Pythonパッケージ配布の仕組みとその安全性向上の流れをつかめるはずです。",Pythonパッケージ配布インフラ,PyPIリポジトリAPIとサプライチェーン安全性
2,型ヒントと注釈の進化,"このグループの主な技術テーマは、Pythonにおける型ヒント、注釈の評価方式、そしてそれを支える文法や型システムの拡張です。ネットワーク図でも PEP 484 が明確な中心にあり、526、3107、563、649 がその周辺を固めていて、関数・変数注釈から現代的な静的型付けへ発展してきた流れが見えます。機能領域としては型ヒント、typingモジュール、ジェネリクス、データクラス連携、型情報の配布にまたがり、2014年以降の提案が特に厚い一方で、3107 が前史として強く結び付いています。Final のPEPが中心ですが、563 のように後で置き換えられた案や、781、746、810 のような新しい周辺提案も含まれ、型付け実用化の広がりを示しています。
このグループのPEPを読むことで、Pythonの型ヒント機能がどう設計され実務向けに拡張されてきたかをつかめそうです。",Python静的型付け基盤,注釈評価とtyping拡張
3,CPython保守性と実装基盤,このグループは、後方互換性、標準ライブラリの整理、C APIの保守、名前空間や実行系の意味論、そして実装性能の改善をまたぐ、CPython本体の進化方針を扱う提案群です。ネットワーク図でもPEP 387が最も大きなハブになっており、594、702、659、744、731などがその周辺に結びついているため、個別機能よりも『安全に変えていくための基盤ルール』が中心にあると見られます。Pythonの機能領域としては、言語仕様そのものより、標準ライブラリ運営、インタプリタ実装、C API、互換性ポリシー、運用時の観測性に関係します。2000年代初頭の古い提案から2026年の新しい提案まで年代は幅広いですが、中心にはActiveやFinalのPEPが多く、近年のCPython整備の流れを強く反映しています。これらのPEPを読むことで、Pythonが壊さずに進化するための設計原則をつかめそうです。,Python本体の進化ポリシー,標準ライブラリ・C API・実行系の整備
4,Pythonガバナンスと運営体制,このグループの主題は、Python本体と周辺組織の意思決定方法、代表機関、選挙手続きといったガバナンス設計です。中心にはPEP 13、8001、8016があり、ネットワーク図でも大きなノードとして集中的に参照を集めているため、2018年の移行期に検討された統治モデルと、その後の運用ルールの核になっていると見られます。内容は言語機能そのものではなく、Pythonコミュニティ運営、プロジェクト管理、標準的な意思決定プロセスの領域に関係します。年代は2018年のガバナンス再設計案に強く集中し、その後は2019年以降の評議会選挙PEPが放射状に連なる構造で、Accepted・Final・Rejectedが混在する点も議論の過程をよく示しています。これらのPEPを読むことで、Pythonがどう統治され、重要な決定がどう正当化されるかをつかめそうです。,Pythonコミュニティの統治モデル,Steering Councilと選挙プロセス
5,Pythonの設計思想とコーディング規約,"このグループの主な技術テーマは、Pythonの書き方の原則、命名や記法の規約、そして言語設計上の読みやすさです。ネットワーク図でも PEP 8 が最大のハブとなっており、20、7、3131 などがその周辺に集まるため、スタイルガイドと設計哲学がこの集合の中心だと見てよさそうです。Pythonの機能領域でいえば、実行機能そのものというより、言語文化、標準的なコーディング規約、標準ライブラリや例外記法を含む周辺設計に関係します。年代は2001〜2024年と幅広いものの、中心には古くから継続的に参照される Active と Final の文書が多く、周辺に提案段階や却下・撤回の案がぶら下がる構造です。なお subprocess や logging、REPL など少し独立気味のPEPも含まれますが、全体としてはPythonらしい書き方と設計判断の感覚をつかむ助けになるグループです。
Pythonで読みやすく一貫したコードを書くための考え方を学べそうです。",Pythonスタイルガイドと言語文化,可読性中心の言語設計・規約群
6,文字列補間と書式指定,"このグループの主題は、Pythonにおける文字列の組み立て方、埋め込み記法、書式指定の進化です。中心にはPEP 3101、498、215があり、ネットワーク図でも大きなノードとして密につながっており、古い補間案から format 系、さらに f-string とその文法整備へ流れが見えます。機能領域としては文字列処理、文法設計、表示フォーマットにまたがっており、2000年代前半の提案から2024〜2025年の template string 関連まで長い時間幅を持つのが特徴です。Final や Accepted の中核PEPが多い一方で、Withdrawn・Rejected の周辺提案が設計の試行錯誤を補っており、Unicode リテラルや型付け、サブプロセス安全化のようなやや周辺的な話題も少し含まれます。
このグループのPEPを読むことで、Pythonの文字列記法がどう実用性と安全性を高めてきたかをつかめそうです。",Python文字列記法の進化,フォーマット文字列と言語文法
7,パッケージメタデータと配布管理,"このグループの主な技術テーマは、Pythonパッケージのメタデータ形式、バージョン指定、依存関係、配布物のインストール記録をどう標準化するかです。ネットワーク図でも PEP 241、345、301、314 が大きなハブになっており、初期のパッケージ情報仕様から後続の更新案や周辺規格へ引用が広がる構造が見えます。機能領域としては packaging と distribution に強く関係し、特に 2001年から2013年にかけての仕様整備が中心で、その後に 566、627、668、819 などが実運用や環境管理の方向へ接続しています。Final や Superseded のPEPが中心なので、現行仕様だけでなく標準化の変遷を追うグループとも言えます。
このグループのPEPを読むことで、Pythonパッケージ公開とインストール管理の標準の成り立ちをつかめるはずです。",Pythonパッケージ仕様と依存関係標準,Packagingメタデータと環境管理
8,Python実行環境と文字コード設定,"このグループの主な技術テーマは、Pythonの起動時設定、実行環境の初期化、そしてUTF-8を中心とした文字コードの扱いです。ネットワーク図でも PEP 540、538、587 が中心にまとまり、528、529、432、741 へつながる構造が見え、Pythonランタイムと設定APIの核になっていることがうかがえます。機能領域としては、インタプリタ初期化、OS環境との境界、Windowsやロケールを含むエンコーディング管理に関係します。2016〜2019年のFinalな提案が中核で、近年の741がその流れをC API側で補強している一方、562、553、552や、Rejectedの315、548、549、713、726などは周辺的な言語・モジュール挙動の話題として混ざっているようです。
このグループのPEPを読むことで、Pythonが起動時に設定と文字コード問題をどう整理してきたかをつかめます。",インタプリタ初期化とUTF-8移行,CPython設定APIと実行時環境
9,非同期処理とジェネレータ進化,"このグループの主題は、ジェネレータを土台にしたコルーチン構文と、Pythonの非同期実行モデルの発展です。中心にはPEP 380、492、525、3156があり、ネットワーク図でも大きなノードとしてまとまっていて、yieldベースの仕組みからasync/awaitや非同期ジェネレータへつながる流れが見えます。機能領域としては、非同期処理、イテレータ/ジェネレータ、イベントループ、並行実行に関係します。2009年から2016年の提案が核で、多くがFinalである一方、523・669・689・733のようにCPython実装や監視・C APIに寄った周辺PEP、472・468・798のようなやや脇の構文系PEPも混ざっています。
このグループのPEPを読むことで、Pythonのasync機能がジェネレータからどう育ってきたかをつかめそうです。",Pythonのコルーチン・async系PEP,ジェネレータからasync/awaitへの系譜
10,構造的パターンマッチングと言語構文拡張,"このグループの主な技術テーマは、Pythonにおける分岐構文の進化、とくに構造的パターンマッチングの設計とその周辺にある構文・文法拡張です。ネットワーク図でも 634、635、636 と、その前段階の PEP 622 が密に結びついた中心クラスタを作っており、過去の 275、3103 は古い switch/case 系の試みとして大きなノードで参照上の重要点になっています。2018〜2021年の提案が多く、Final のPEPが中心なので、Python 3.10前後の言語仕様・パーサ・文法変更をまとめたグループとして見るのが自然です。572、617、640、653 などは代入式、PEGパーサ、未使用変数記法、意味論の精密化として中心テーマを支えており、一部に 619 や 644 のような周辺的なPEPも含まれます。
このグループのPEPを読むことで、Pythonが新しい分岐構文をどう設計し実装したかをつかめるでしょう。",Python 3.10の分岐構文と文法変更,パターンマッチング設計史
11,CPython拡張モジュールとマルチインタプリタ基盤,"このグループの主題は、C拡張モジュールの初期化・状態管理・ABI安定化と、それを支えるマルチインタプリタやGIL見直しの実行基盤です。ネットワーク図でも PEP 3121、489、684、703、554/734 付近に結節点があり、古い拡張モジュール設計から近年のfree-threaded対応へ流れがつながっているように見えます。特に 3121、489、573 は拡張モジュールのライフサイクルとモジュール状態の扱いで中心的で、652、697、803、809 は安定ABIや限定C APIの方向を補強しています。Pythonの機能領域としては、CPython実装、C API/ABI、拡張モジュール、並行実行基盤にまたがるテーマで、2007年の古い提案から2025年のAccepted/Draftまで継続的に更新されている点も特徴です。
このグループのPEPを読むことで、C拡張が将来のマルチインタプリタ化やfree-threaded化にどう適応していくかをつかめると思われます。",C拡張API・ABIとfree-threaded Python,拡張モジュール隔離とインタプリタ並行実行
12,CPython開発運用とリリース管理,"このグループの主な技術テーマは、CPython本体の開発プロセス、ソースコード管理、リリース運用、配布物の扱いです。ネットワーク図でも PEP 462、507、101 が大きく、開発ワークフロー自動化、リポジトリ移行、リリース手順が中心にまとまっていることがわかります。特に 347、385、512、507、481 はバージョン管理やホスティング基盤の変遷を示しており、Pythonの言語機能というよりプロジェクト運営と開発基盤の領域に属します。2000年代初頭から2024年の 761 まで年代は幅広く、Final・Active・Withdrawn・Rejected が混在しているため、継続的に見直されてきた運用テーマの集まりと見てよさそうです。
このグループのPEPを読むことで、CPythonがどのように開発・公開・保守されてきたかの流れをつかめます。",Pythonプロジェクトの開発基盤と公開手順,CPythonのリポジトリ移行・保守運営
13,Python 2.x初期の実装改善と周辺機能整備,"このグループは、2001〜2004年ごろのPython 2.xで進められた、実行性能の改善と基盤機能の整備を中心にまとまっているようです。特に中心にあるのはPEP 266、267、280で、グローバル参照やモジュール名前空間の最適化といったインタプリタ実装寄りの話題が核になっています。ネットワーク図でも283と320が周辺の多様な提案を束ねるハブになっており、リリース計画を軸に、文字コード、ロギング、真偽値、反復、pickle、拡張モジュールなどの標準機能が同じ時期に結び付いています。Finalが多く時代的にも初期PEPに集中していますが、中心部にはWithdrawnやDeferredも目立つため、採用済み仕様というより当時の言語処理系と標準ライブラリの設計検討の集まりと見るのが自然です。
このグループのPEPを読むことで、Python 2.x初期に何を性能面・基盤面で整えようとしていたかをつかめます。",Python初期の言語基盤・標準機能アップデート,Python 2.x基盤設計と最適化提案群
14,コンテキスト管理とジェネレータ制御,"このグループの主題は、リソース管理を安全に行う構文と、その基盤になるイテレータ・ジェネレータ・コルーチンの制御モデルです。ネットワーク図でも中心にはPEP 343、342、255、234がまとまっており、Finalの提案が核になってPythonの文法と実行モデルを形作った流れが見えます。Pythonの機能領域としては、制御構文、反復処理、軽量な非同期・協調的処理、そしてファイルやロックなどの資源管理に関係します。年代は2000年代前半に強く集中しており、RejectedやWithdrawnの周辺提案が、最終的に採用された設計へ収束していった構造も読み取れます。なお333、3333、444は周辺的な接続でやや異質ですが、インターフェースや実行の枠組みという観点で隣接しているのかもしれません。
このグループのPEPを読むことで、Pythonがwith文とジェネレータ中心の実行モデルをどう固めたかをつかめそうです。",with文・ジェネレータ・コルーチン設計,Pythonの制御フローと資源管理
15,Python 3.2–3.3基盤整備と実装メタデータ,"このグループは、Python 3.2〜3.3前後に進んだ言語・標準ライブラリ・実装情報の基盤整備を中心とする提案群です。ネットワーク図でも PEP 399、3155、421、3003 が比較的大きく、純Python/C実装の整合、修飾名、実装識別、言語進化の抑制方針といったコアな設計判断が中心に見えます。機能領域としては、インタプリタ実装、標準ライブラリ運用、イントロスペクション、時間API、シリアライズなどの“Python本体の足回り”に関係します。2010年代前半のFinalが中心ですが、564、737、739のように後年の実装情報やビルド記述へ伸びる枝もあり、少数のRejected/Deferred/Withdrawnは周辺論点を補っています。
このグループのPEPを読むことで、Python本体がどう整備され安定化してきたかをつかめそうです。",Pythonコア実装と標準ライブラリの整備,インタプリタ基盤・リリース運用・内部API
16,importシステムとモジュール実行,"このグループの主な技術テーマは、Pythonのimport機構、パッケージ構造、そしてモジュールをスクリプトとして実行する際の振る舞いです。中心にはPEP 302があり、338、366、328、451、420が周辺から強く結びついていて、ネットワーク図でもimport周辺の設計変更が一つの核を作っているように見えます。機能領域としては、モジュール探索、ローダー、名前空間パッケージ、__main__の扱い、バイトコード配置などに関わる、Pythonの実行基盤そのものです。2001年から2015年にかけて議論が続いており、Finalが中心ですが、RejectedやWithdrawnも一定数あって、import設計の難しさも表れています。
このグループのPEPを読むことで、Pythonがモジュールを見つけて読み込み、実行する仕組みの進化をつかめるはずです。",Pythonのimport機構とパッケージ設計,モジュール読み込み・名前空間パッケージ
17,高度な型ヒント拡張,"このグループは、Pythonの型ヒントをより表現力豊かにする提案群で、特にジェネリクス、関数シグネチャ、TypedDictまわりの精密化に焦点があります。ネットワーク図でも PEP 646、589、585、604、692 が核になっており、Final の提案が中心にまとまっているため、実際の型システム拡張の流れを反映した塊と見てよさそうです。2019年以降の比較的新しいPEPが多く、標準コレクションのジェネリクス化、可変長ジェネリクス、辞書ベースの構造的型付け、kwargs や Callable の型表現など、typing 機能領域の発展が段階的に進んでいることが読み取れます。Rejected や Draft の提案も周辺にあり、記法や未確定の設計論点を補う枝として見えます。
このグループのPEPを読むことで、Pythonの静的型付けがどこまで実用的かをつかめるはずです。",Python typingの表現力強化,ジェネリクスとTypedDictの型システム
18,PEP運営と文書化基盤,このグループの主な技術テーマは、PEPの進め方そのものと、docstring・reStructuredText・ドキュメント記述規約の整備です。中心にはPageRankが高いPEP 1があり、12、287、676、729が周辺で結びついているため、ネットワーク図でもプロセス規定と文書基盤が核になっていると読めます。Python本体の新機能というより、言語コミュニティの運営、提案手続き、公式文書の書き方に関わる機能領域のまとまりです。年代は2000年代初頭の文書化PEPが多く、そこに2020年代の運営関連PEPや型システム運営の話題が後から接続している構造で、RejectedやWithdrawnも目立つため試行錯誤の歴史も反映されています。なお647、724、742の型絞り込み系はやや異質ですが、729を介した運営面のつながりで同居している可能性があり、このグループを読むとPythonコミュニティが仕様と文書ルールをどう整えてきたかをつかめそうです。,Python文書規約とPEPプロセス,ドキュメント標準化と提案ガバナンス
19,内包表記と反復処理,"このグループは、Pythonのコレクション生成を簡潔に書く構文と、forループまわりの反復処理をどう設計するかを中心にした提案群です。中心にはPEP 202、212、279、289があり、ネットワーク図でも大きなノードとして結び付きが強く、初期の2000〜2003年の議論が核になっていることが読み取れます。機能領域としては、反復可能オブジェクト、内包表記、ジェネレータ、アンパック、集合や範囲のような組み込みデータ操作にまたがっており、FinalのPEPが中核を占める一方で、ループカウンタ構文や整数ループのように却下された案も周辺に集まっています。2013年の448や2025年の802のような後年の提案もありますが、構造的には初期の反復・コレクション構文の発展を補強する枝として見えます。
このグループのPEPを読むことで、Pythonらしい繰り返し処理の書き方がどのように形作られたかをつかめます。",Pythonの反復構文設計,イテレーションとコレクション生成
20,Python 3移行と例外体系の再設計,"このグループは、Python 2から3への移行期に行われた言語整理、標準ライブラリの見直し、例外機構の再設計を中心とする提案群です。ネットワーク図でもPEP 4と3100が大きなハブになっており、4、3100、3099が全体方針を示し、その周辺に352、3110、3151のような例外関連の具体策や、290、3001のような移行・近代化の議論が結び付いています。機能領域としては、Python 3への互換性整理、標準ライブラリ管理、例外処理設計、リリース移行計画にまたがっており、2000年代前半から2010年ごろに集中した移行期の色合いが強いです。FinalやActiveの中心PEPが多い一方で、348や294、3001のように採用されなかった案も含まれ、検討過程の試行錯誤も見えます。
このグループのPEPを読むことで、Python 3世代への設計転換の考え方をつかめると思われます。",Python 3.0設計移行と標準ライブラリ整理,Python 3導入期の互換性・例外処理改革
21,バイナリ型と数値型の基盤設計,"このグループは、Pythonの基本データモデルのうち、バイト列・バッファ・数値体系をどう整理するかに関する提案群です。中心には PEP 3119、358、3141 があり、ネットワーク図でも大きなノードとして見えており、抽象的な型の枠組みと、bytes 系API、数値の型階層がこの集まりの核になっていると考えられます。年代は2000年代前半から2014年までにまたがりますが、特に Python 3 移行期の2006〜2007年に Final の重要提案が集中しており、言語のコアな型システムやデータ表現に関係する領域です。周辺にはバイナリ書式化や有理数リテラルのような未採用・撤回案も混ざっており、中心テーマに対する派生的な試みとして見えます。
このグループのPEPを読むことで、Pythonがバイト列と数値をどのような設計思想で整備してきたかをつかめそうです。",Pythonコア型システムの再編,bytes・数値モデル・抽象型
